{"schema_version":"profile/1","profile_id":"prof-pilot-aha","subject_type":"organization","target_types":["grant"],"as_of":"2026-10-20","provenance":{"source_kind":"legacy_brief","sources":[{"title":"aha-nonprofit.json","locator":"research/eval/briefs/aha-nonprofit.json","retrieved_at":"2026-10-20"}],"built_by":"code","builder_saw_anchor":false},"fields":{"applicant.name":{"value":"AHA","source":"legacy_brief: aha-nonprofit.json#company","as_of":"2026-10-20","quote":null},"applicant.entity_type":{"value":"nonprofit","source":"legacy_brief: aha-nonprofit.json#entityType","as_of":"2026-10-20","quote":null},"applicant.country":{"value":null,"source":"not provided","as_of":"2026-10-20","quote":null},"applicant.region":{"value":null,"source":"not provided","as_of":"2026-10-20","quote":null},"applicant.small_business":{"value":null,"source":"not provided","as_of":"2026-10-20","quote":null},"applicant.ownership_us_51":{"value":null,"source":"not provided","as_of":"2026-10-20","quote":null},"applicant.employees":{"value":null,"source":"not provided","as_of":"2026-10-20","quote":null},"applicant.partners":{"value":null,"source":"not provided","as_of":"2026-10-20","quote":null},"applicant.can_cost_share":{"value":null,"source":"not provided","as_of":"2026-10-20","quote":null},"project.title":{"value":"Agentic Harmonization Assistant (AHA) and AHA Connect","source":"legacy_brief: aha-nonprofit.json#product","as_of":"2026-10-20","quote":null},"project.summary":{"value":"AI-powered multi-modal data harmonization, statistical crosswalks (e.g., MMSE vs MoCA) and researcher matching for Alzheimer's disease and related dementias research in the AD Workbench. Open-science, non-profit infrastructure.","source":"legacy_brief: aha-nonprofit.json#description","as_of":"2026-10-20","quote":null},"project.sector":{"value":["alzheimer's disease research data infrastructure","AI data harmonization"],"source":"legacy_brief: aha-nonprofit.json#industry","as_of":"2026-10-20","quote":null},"project.work_type":{"value":null,"source":"not provided","as_of":"2026-10-20","quote":null},"project.stage":{"value":"prototype","source":"legacy_brief: aha-nonprofit.json#stage","as_of":"2026-10-20","quote":null},"project.foreign_components":{"value":null,"source":"not provided","as_of":"2026-10-20","quote":null},"team.pi.country_residence":{"value":null,"source":"not provided","as_of":"2026-10-20","quote":null},"team.pi.primary_employer_is_applicant":{"value":null,"source":"not provided","as_of":"2026-10-20","quote":null},"team.pi.credentials":{"value":null,"source":"not provided","as_of":"2026-10-20","quote":null},"funding.amount_needed_usd":{"value":350000,"source":"legacy_brief: aha-nonprofit.json#amount","as_of":"2026-10-20","quote":null},"funding.instruments_accepted":{"value":["grant","prize","cooperative_agreement"],"source":"legacy_brief: aha-nonprofit.json#fundingTypes","as_of":"2026-10-20","quote":null},"funding.routes_accepted":{"value":null,"source":"not provided","as_of":"2026-10-20","quote":null},"preferences.min_prep_days":{"value":null,"source":"not provided","as_of":"2026-10-20","quote":null},"preferences.excluded_funders":{"value":null,"source":"not provided","as_of":"2026-10-20","quote":null}}}
