{"schema_version":"profile/1","profile_id":"prof-pilot-mentiva","subject_type":"organization","target_types":["grant"],"as_of":"2026-10-20","provenance":{"source_kind":"legacy_brief","sources":[{"title":"mentiva.json","locator":"research/eval/briefs/mentiva.json","retrieved_at":"2026-10-20"}],"built_by":"code","builder_saw_anchor":false},"fields":{"applicant.name":{"value":"Mentiva","source":"legacy_brief: mentiva.json#company","as_of":"2026-10-20","quote":null},"applicant.entity_type":{"value":null,"source":"not provided","as_of":"2026-10-20","quote":null},"applicant.country":{"value":null,"source":"not provided","as_of":"2026-10-20","quote":null},"applicant.region":{"value":null,"source":"not provided","as_of":"2026-10-20","quote":null},"applicant.small_business":{"value":null,"source":"not provided","as_of":"2026-10-20","quote":null},"applicant.ownership_us_51":{"value":null,"source":"not provided","as_of":"2026-10-20","quote":null},"applicant.employees":{"value":null,"source":"not provided","as_of":"2026-10-20","quote":null},"applicant.partners":{"value":null,"source":"not provided","as_of":"2026-10-20","quote":null},"applicant.can_cost_share":{"value":null,"source":"not provided","as_of":"2026-10-20","quote":null},"project.title":{"value":"Platform for digital well-being and navigation toward care experiences","source":"legacy_brief: mentiva.json#product","as_of":"2026-10-20","quote":null},"project.summary":{"value":"Helps individuals understand what's weighing on them, observe changes over time, and find relevant next steps without diagnosing.","source":"legacy_brief: mentiva.json#description","as_of":"2026-10-20","quote":null},"project.sector":{"value":["wellness mental health digital health"],"source":"legacy_brief: mentiva.json#industry","as_of":"2026-10-20","quote":null},"project.work_type":{"value":null,"source":"not provided","as_of":"2026-10-20","quote":null},"project.stage":{"value":"prototype","source":"legacy_brief: mentiva.json#stage","as_of":"2026-10-20","quote":null},"project.foreign_components":{"value":null,"source":"not provided","as_of":"2026-10-20","quote":null},"team.pi.country_residence":{"value":null,"source":"not provided","as_of":"2026-10-20","quote":null},"team.pi.primary_employer_is_applicant":{"value":null,"source":"not provided","as_of":"2026-10-20","quote":null},"team.pi.credentials":{"value":null,"source":"not provided","as_of":"2026-10-20","quote":null},"funding.amount_needed_usd":{"value":null,"source":"not provided","as_of":"2026-10-20","quote":null},"funding.instruments_accepted":{"value":["grant","prize","cooperative_agreement"],"source":"legacy_brief: mentiva.json#fundingTypes","as_of":"2026-10-20","quote":null},"funding.routes_accepted":{"value":null,"source":"not provided","as_of":"2026-10-20","quote":null},"preferences.min_prep_days":{"value":null,"source":"not provided","as_of":"2026-10-20","quote":null},"preferences.excluded_funders":{"value":null,"source":"not provided","as_of":"2026-10-20","quote":null}}}
